{
  "id": "level-002",
  "name": "Corners",
  "gridWidth": 6,
  "gridHeight": 5,
  "servers": [
    {
      "x": 4,
      "y": 0,
      "meltdownThreshold": 100,
      "safeThreshold": 40,
      "heatRate": 3,
      "coolingRate": 7
    },
    {
      "x": 4,
      "y": 4,
      "meltdownThreshold": 100,
      "safeThreshold": 40,
      "heatRate": 3,
      "coolingRate": 7
    }
  ],
  "coldSources": [
    {
      "x": 0,
      "y": 2,
      "direction": "right",
      "strength": 1
    },
    {
      "x": 5,
      "y": 2,
      "direction": "left",
      "strength": 1
    }
  ],
  "obstacles": [],
  "availableTiles": {
    "straight": 4,
    "corner": 4,
    "t_junction": 1,
    "cross": 0
  },
  "scoring": {
    "threeStarTiles": 4,
    "twoStarTiles": 6,
    "threeStarTime": 40,
    "twoStarTime": 80
  }
}
